{
  "schema_version": "1.0",
  "prompt_id": "P-STAGE6D-WRITE-SECTION",
  "prompt_version": "1.0.0",
  "actual_model_id": "gpt-5.6-thinking",
  "endpoint_id": "chatgpt-conversation-file-bridge",
  "status": "PASS",
  "section_id": "SEC-14",
  "candidate": {
    "candidate_id": "cand-stage6d-sec-14-001",
    "section_name": "结论",
    "markdown": "# 结论\n\n## 研究问题闭环\n\n对于RQ-1，本项目以OBJ-1和OBJ-2为牵引，通过统一对象与关系Schema、版本依赖和增量失效传播保持多智能体状态一致，并以一致性试验和全量重算对照判断有效性；若关键对象和约束仍不能稳定同步，则该回答被反证。对于RQ-2，以OBJ-2和OBJ-3为牵引，将模型推理、优化求解和人工注意力视为有限窗口资源，通过边际增益、风险和证据完整性调度下一动作；若相同预算下不能优于固定顺序或固定轮次，则相应机制不成立。\n\n对于RQ-3，本项目以OBJ-3和OBJ-4为牵引，通过偏好版本、权限交接、人工最终确认和全过程Trace界定责任，并以纯人工、纯自动和人机协同对照检验负担、采纳表现与可追溯性；若不能在保持人工控制的同时获得可解释收益，则该回答被反证。由此，四项目标分别落到状态模型、候选竞争、人工关键干预和跨场景验证，不以原型功能数量代替研究问题的证据闭环。\n\n## 中心命题与边界\n\nCP-1的预期贡献由三项待验证假设共同支撑：INNO-H1检验共享态势、版本依赖与增量失效传播能否优于仅共享对话上下文；INNO-H2检验统一调度推理、求解和人工注意力能否提高单位时间决策增益；INNO-H3检验结构化候选、Finding、工具结果和人工决定的Trace能否形成可审计的人机协同收益证据。三项均须通过既定比较和消融试验后才能转化为结论。\n\n中心命题的成立条件是场景可结构化、存在确定性校验工具、业务人员能够进行有限关键判断、模型端点遵循统一合同且授权人员保留最终确认权；任一条件长期不满足，或三项研究问题的比较规则均未显示优势，都应限制、降级或否定相应结论。最终开放事项仍包括正式指南与模板、资格和时间节点、申报单位与资助机构、团队名单、经费、项目周期及研究基础证明材料，因此当前文本仅具备全文集成条件，不代表最终申报条件已经齐备。\n",
    "subsections": [
      {
        "subsection_id": "SEC-14-01",
        "title": "研究问题闭环",
        "paragraphs": [
          {
            "paragraph_id": "P-SEC-14-01",
            "role": "逐一回答RQ-1、RQ-2和RQ-3",
            "text": "对于RQ-1，本项目以OBJ-1和OBJ-2为牵引，通过统一对象与关系Schema、版本依赖和增量失效传播保持多智能体状态一致，并以一致性试验和全量重算对照判断有效性；若关键对象和约束仍不能稳定同步，则该回答被反证。对于RQ-2，以OBJ-2和OBJ-3为牵引，将模型推理、优化求解和人工注意力视为有限窗口资源，通过边际增益、风险和证据完整性调度下一动作；若相同预算下不能优于固定顺序或固定轮次，则相应机制不成立。",
            "node_ids": [
              "RQ-1",
              "RQ-2",
              "OBJ-1",
              "OBJ-2",
              "OBJ-3"
            ],
            "rq_ids": [
              "RQ-1",
              "RQ-2"
            ],
            "source_ids": [],
            "claim_status": "PROJECT_PLAN",
            "novel_content_key": "conclusion_rq1_rq2_closure"
          },
          {
            "paragraph_id": "P-SEC-14-02",
            "role": "绑定目标、机制和验证证据",
            "text": "对于RQ-3，本项目以OBJ-3和OBJ-4为牵引，通过偏好版本、权限交接、人工最终确认和全过程Trace界定责任，并以纯人工、纯自动和人机协同对照检验负担、采纳表现与可追溯性；若不能在保持人工控制的同时获得可解释收益，则该回答被反证。由此，四项目标分别落到状态模型、候选竞争、人工关键干预和跨场景验证，不以原型功能数量代替研究问题的证据闭环。",
            "node_ids": [
              "RQ-3",
              "OBJ-3",
              "OBJ-4"
            ],
            "rq_ids": [
              "RQ-3"
            ],
            "source_ids": [],
            "claim_status": "PROJECT_PLAN",
            "novel_content_key": "conclusion_rq3_objective_closure"
          }
        ]
      },
      {
        "subsection_id": "SEC-14-02",
        "title": "中心命题与边界",
        "paragraphs": [
          {
            "paragraph_id": "P-SEC-14-03",
            "role": "回扣三项创新假设",
            "text": "CP-1的预期贡献由三项待验证假设共同支撑：INNO-H1检验共享态势、版本依赖与增量失效传播能否优于仅共享对话上下文；INNO-H2检验统一调度推理、求解和人工注意力能否提高单位时间决策增益；INNO-H3检验结构化候选、Finding、工具结果和人工决定的Trace能否形成可审计的人机协同收益证据。三项均须通过既定比较和消融试验后才能转化为结论。",
            "node_ids": [
              "CP-1",
              "INNO-H1",
              "INNO-H2",
              "INNO-H3"
            ],
            "rq_ids": [
              "RQ-1",
              "RQ-2",
              "RQ-3"
            ],
            "source_ids": [],
            "claim_status": "PROJECT_PLAN",
            "novel_content_key": "conclusion_innovation_hypotheses"
          },
          {
            "paragraph_id": "P-SEC-14-04",
            "role": "说明成立条件、反证和未决事项",
            "text": "中心命题的成立条件是场景可结构化、存在确定性校验工具、业务人员能够进行有限关键判断、模型端点遵循统一合同且授权人员保留最终确认权；任一条件长期不满足，或三项研究问题的比较规则均未显示优势，都应限制、降级或否定相应结论。最终开放事项仍包括正式指南与模板、资格和时间节点、申报单位与资助机构、团队名单、经费、项目周期及研究基础证明材料，因此当前文本仅具备全文集成条件，不代表最终申报条件已经齐备。",
            "node_ids": [
              "CP-1",
              "OBJ-1",
              "OBJ-2",
              "OBJ-3",
              "OBJ-4"
            ],
            "rq_ids": [
              "RQ-1",
              "RQ-2",
              "RQ-3"
            ],
            "source_ids": [],
            "claim_status": "BOUNDARY_STATEMENT",
            "novel_content_key": "conclusion_conditions_open_items"
          }
        ]
      }
    ],
    "visual_placeholders": [],
    "unresolved_open_item_ids": [
      "OPEN-001",
      "OPEN-002",
      "OPEN-003",
      "OPEN-004",
      "OPEN-005",
      "OPEN-006",
      "OPEN-007",
      "OPEN-008",
      "OPEN-009",
      "OPEN-010",
      "OPEN-011",
      "OPEN-012"
    ],
    "key_terms": [
      {
        "term": "论证闭环",
        "canonical_form": "论证闭环"
      },
      {
        "term": "中心命题",
        "canonical_form": "中心命题"
      }
    ],
    "section_contribution": "逐一闭合三项研究问题、目标、创新假设和中心命题，同时保留反证条件与最终开放事项。"
  },
  "findings": [],
  "warnings": []
}
